{
  "repo": ".claude-prime",
  "coordinator_root_path": ".",
  "title": "Cockpit: work-state data contract (the pinned interface)",
  "created": "2026-06-21",
  "status": "consumed",
  "kind": "spinoff-roadmap",
  "deployment_state": "in_flight",
  "workstream": "opticon-surface",
  "predecessor": "none",
  "scope": ["plugins/coordinator/cockpit-contract/"],
  "provenance": {
    "source_kind": "coordinator_artifact",
    "repo": ".claude-prime",
    "ref": { "branch": "work/macbookair/2026-06-17to22", "sha": "647732fa" },
    "path": "state/handoffs/2026-06-21_210002_roadmap-work-cockpit-2026-06-21-tc-2.md",
    "observed_at": "2026-06-22T03:05:00Z",
    "derivation": "parsed"
  }
}
